{
  "schema_version": "1.0.0",
  "corpus_version": "1.0.0",
  "document_id": "COS-H1-DOC-CLASSIFICATIONS",
  "document_class": "CORPUS_CLASSIFICATIONS",
  "normative": true,
  "owner": "Zest-LeadGen",
  "policy_owner": "Zest-LeadGen",
  "decision_provenance": {
    "packet_preparation_authorization_id": "H1-B1A-G-DECISIONS-AND-PACKET-PREPARATION-2026-07-31-R1",
    "implementation_design_decision_id": "H1-B1A-G-IMPLEMENTATION-DESIGN-2026-07-31-R1",
    "parent_issue": 58,
    "planning_issue": 78,
    "master_roadmap_issue": 79,
    "owner_decision_register_issue": 70,
    "resolution": "AUTHORITY_INDEX_AND_LIVE_ISSUE_REQUIRED",
    "role": "STABLE_POLICY_PROVENANCE_NOT_LIVE_COMMENT_AUTHORITY",
    "target_gate": "H1_B1A_G",
    "h1_b1a_g_model": "CONTRACT_COMPLETE_EXECUTION_EMPTY"
  },
  "implementation_authority": "LIVE_GITHUB_REQUIRED",
  "source_requirement_ids": [
    "H1B1-CLASS-001",
    "H1B1-CLASS-002",
    "H1B1-CLASS-003",
    "H1B1-CLASS-004",
    "H1B1-CLASS-005",
    "H1B1-CLASS-006",
    "H1B1-CLASS-008",
    "H1B1-POST-001",
    "H1B1-POST-002",
    "H1B1-POST-003",
    "H1B1-EVID-001",
    "H1B1-EVID-002",
    "H1B1-EVID-003",
    "H1B1-EVID-004",
    "H1B1-EVID-006",
    "H1B1-OPS-003"
  ],
  "source_decision_ids": [
    "H1B1-OD-006"
  ],
  "rules": [
    {
      "rule_id": "COS-H1-CLASS-001",
      "version_introduced": "1.0.0",
      "status": "ACTIVE",
      "normative_text": "The closed primary classifications are exactly: STABLE_POLICY, MUTABLE_LIVE_STATE, DERIVED_POINT_IN_TIME_STATE, HISTORICAL_AUDIT_EVIDENCE, GENERATED_PRESENTATION, and NON_NORMATIVE_GUIDANCE. No other primary classification is permitted without a later owner decision that expands this closed set.",
      "classification": "STABLE_POLICY",
      "owner": "Zest-LeadGen",
      "source_requirement_ids": [
        "H1B1-CLASS-001"
      ],
      "source_decision_ids": [],
      "supersedes": [],
      "superseded_by": [],
      "design_decision_ids": []
    },
    {
      "rule_id": "COS-H1-CLASS-002",
      "version_introduced": "1.0.0",
      "status": "ACTIVE",
      "normative_text": "Every governing file in the canonical manifest must have exactly one primary classification, an owner, a policy_owner, a schema or version reference, a normative status, a supersession policy, and source_requirement_ids.",
      "classification": "STABLE_POLICY",
      "owner": "Zest-LeadGen",
      "source_requirement_ids": [
        "H1B1-CLASS-002",
        "H1B1-TREE-001"
      ],
      "source_decision_ids": [],
      "supersedes": [],
      "superseded_by": [],
      "design_decision_ids": []
    },
    {
      "rule_id": "COS-H1-CLASS-003",
      "version_introduced": "1.0.0",
      "status": "ACTIVE",
      "normative_text": "STABLE_POLICY must not embed current pull requests, live lifecycle state, active issue status, current main SHA, current branch names as permanent facts, or current workflow state, except inside clearly labeled immutable historical examples that conform to the historical-example exemption.",
      "classification": "STABLE_POLICY",
      "owner": "Zest-LeadGen",
      "source_requirement_ids": [
        "H1B1-CLASS-003",
        "H1B1-OPS-003"
      ],
      "source_decision_ids": [],
      "supersedes": [],
      "superseded_by": [],
      "design_decision_ids": []
    },
    {
      "rule_id": "COS-H1-CLASS-004",
      "version_introduced": "1.0.0",
      "status": "ACTIVE",
      "normative_text": "A historical example is permitted inside stable policy only as a non-current evidence object with example_class=HISTORICAL_AUDIT_EVIDENCE, non_current=true, live_authority=false, a checkpoint with repository, exact 40-character commit_sha or the exact template placeholder <EXACT_40_CHARACTER_SHA>, and RFC3339 observed_at or the exact template placeholder <RFC3339_TIMESTAMP>, and a limited supported_proposition. Historical examples create no owner authority.",
      "classification": "STABLE_POLICY",
      "owner": "Zest-LeadGen",
      "source_requirement_ids": [
        "H1B1-CLASS-008"
      ],
      "source_decision_ids": [
        "H1B1-OD-006"
      ],
      "supersedes": [],
      "superseded_by": [],
      "historical_example_exemption": {
        "example_class": "HISTORICAL_AUDIT_EVIDENCE",
        "non_current": true,
        "live_authority": false,
        "required_fields": [
          "example_class",
          "non_current",
          "live_authority",
          "checkpoint.repository",
          "checkpoint.commit_sha",
          "checkpoint.observed_at",
          "supported_proposition"
        ],
        "markdown_heading": "Historical example \u2014 non-current audit evidence"
      },
      "design_decision_ids": []
    },
    {
      "rule_id": "COS-H1-CLASS-005",
      "version_introduced": "1.0.0",
      "status": "ACTIVE",
      "normative_text": "MUTABLE_LIVE_STATE requires LIVE_GITHUB_REQUIRED freshness. DERIVED_POINT_IN_TIME_STATE requires an explicit observation time and source identifiers and is never live authority. GENERATED_PRESENTATION and NON_NORMATIVE_GUIDANCE create no normative authority.",
      "classification": "STABLE_POLICY",
      "owner": "Zest-LeadGen",
      "source_requirement_ids": [
        "H1B1-CLASS-001",
        "H1B1-CLASS-004",
        "H1B1-CLASS-005",
        "H1B1-CLASS-006",
        "H1B1-OPS-003"
      ],
      "source_decision_ids": [],
      "supersedes": [],
      "superseded_by": [],
      "design_decision_ids": []
    },
    {
      "rule_id": "COS-H1-CLASS-006",
      "version_introduced": "1.0.0",
      "status": "ACTIVE",
      "normative_text": "Mandatory classification metadata for each classified artifact includes: primary_classification, owner, policy_owner, normative_status, freshness_class, and whether the artifact may control present action.",
      "classification": "STABLE_POLICY",
      "owner": "Zest-LeadGen",
      "source_requirement_ids": [
        "H1B1-CLASS-002",
        "H1B1-CLASS-006"
      ],
      "source_decision_ids": [],
      "supersedes": [],
      "superseded_by": [],
      "design_decision_ids": []
    },
    {
      "rule_id": "COS-H1-CLASS-007",
      "version_introduced": "1.0.0",
      "status": "ACTIVE",
      "normative_text": "Every unposted planning or publication artifact must contain all three exact classifications: DRAFT_STATUS=NOT_POSTED, DRAFT_POSTING_AUTHORITY=NOT_YET_GRANTED, and IMPLEMENTATION_AUTHORITY=NONE. Aliases, synonyms, equivalent values, alternate fields, omissions, conflicting duplicates, or additional values that alter these classifications are prohibited.",
      "classification": "STABLE_POLICY",
      "owner": "Zest-LeadGen",
      "source_requirement_ids": [
        "H1B1-POST-001",
        "H1B1-POST-002",
        "H1B1-POST-003"
      ],
      "source_decision_ids": [],
      "supersedes": [],
      "superseded_by": [],
      "design_decision_ids": []
    },
    {
      "rule_id": "COS-H1-CLASS-008",
      "version_introduced": "1.0.0",
      "status": "ACTIVE",
      "normative_text": "Planning evidence for H1-B1 planning must record PLANNING_EVIDENCE_CLASS=INDEXED_AND_TARGETED_DISCOVERY, FULL_TREE_AUDIT_PERFORMED=NO, EXHAUSTIVE_FULL_TREE_ENUMERATION=NOT_PERFORMED, KNOWN_HOTSPOTS_ARE_NOT_AN_EXHAUSTIVE_ALLOWLIST=true, and ABSENCE_OF_UNDISCOVERED_FILES=NOT_PROVEN. Wording that implies exact-tree completeness is prohibited for that planning package.",
      "classification": "STABLE_POLICY",
      "owner": "Zest-LeadGen",
      "source_requirement_ids": [
        "H1B1-EVID-001",
        "H1B1-EVID-002",
        "H1B1-EVID-003",
        "H1B1-EVID-004",
        "H1B1-EVID-006"
      ],
      "source_decision_ids": [],
      "supersedes": [],
      "superseded_by": [],
      "design_decision_ids": []
    }
  ],
  "primary_classifications": [
    {
      "classification_id": "STABLE_POLICY",
      "normative_capability": "Defines durable normative controls that may govern current action when ACTIVE.",
      "may_control_current_action": true,
      "source_requirements": "Durable owner-approved normative records with explicit version and supersession lineage.",
      "freshness_requirements": "Stable until explicit supersession; not subject to live-state refresh cadence.",
      "live_readback_requirements": "Not required for stable text after protected merge; activation claims remain LIVE_GITHUB_REQUIRED where asserted.",
      "stale_state_effect": "Not applicable as live mutable state; superseded text remains historical.",
      "historical_preservation_behavior": "Preserve prior versions via explicit supersession lineage; silent deletion prohibited.",
      "authority_implications": "May control current action only while status is ACTIVE and not superseded.",
      "permitted_consumers": [
        "H1_TRUSTED_VALIDATOR",
        "OWNER",
        "RED_TEAM",
        "DEVELOPER_READ",
        "FUTURE_POLICY_COMPILER"
      ]
    },
    {
      "classification_id": "MUTABLE_LIVE_STATE",
      "normative_capability": "Describes live repository, issue, PR, workflow, approval, merge, and lifecycle claims.",
      "may_control_current_action": false,
      "source_requirements": "Primary complete live GitHub evidence only.",
      "freshness_requirements": "Must be re-read from live GitHub at the moment of use.",
      "live_readback_requirements": "REQUIRED before any consequential claim or mutation.",
      "stale_state_effect": "Stale observations must not control current action; demote to derived or historical classes.",
      "historical_preservation_behavior": "Past observations may be preserved as historical evidence with exact timestamps and SHAs.",
      "authority_implications": "Cannot substitute for durable owner authority or stable policy.",
      "permitted_consumers": [
        "LIVE_VERIFICATION_ACTORS",
        "PACKET_PREPARERS",
        "RED_TEAM"
      ]
    },
    {
      "classification_id": "DERIVED_POINT_IN_TIME_STATE",